<?xml version="1.0" encoding="UTF-8" ?>
<!DOCTYPE countries SYSTEM "weather.dtd">
<?xml-stylesheet type="text/xml" href="weather.xsl" version="1.0"?>
<countries>
    <country name="United Kingdom">
        <cities>
            <city name="London">
                <days>
                    <day name="Monday">
                        <temperature unit="°C">
                            <min>13.0</min>
                            <max>13.5</max>
                        </temperature>
                        <humidity unit="%">
                            <min>89</min>
                            <max>91</max>
                        </humidity>
                        <wind-speed unit="km/h">
                            <min>13</min>
                            <max>15</max>
                        </wind-speed>
                    </day>
                    <day name="Tuesday">
                        <temperature unit="°C">
                            <min>13.5</min>
                            <max>14.5</max>
                        </temperature>
                        <humidity unit="%">
                            <min>85</min>
                            <max>90</max>
                        </humidity>
                        <wind-speed unit="km/h">
                            <min>12</min>
                            <max>14</max>
                        </wind-speed>
                    </day>
                </days>
            </city>
            <city name="London">
                <days>
                    <day name="Monday">
                        <temperature unit="°C">
                            <min>13.0</min>
                            <max>13.5</max>
                        </temperature>
                        <humidity unit="%">
                            <min>89</min>
                            <max>91</max>
                        </humidity>
                        <wind-speed unit="km/h">
                            <min>13</min>
                            <max>15</max>
                        </wind-speed>
                    </day>
                    <day name="Tuesday">
                        <temperature unit="°C">
                            <min>13.5</min>
                            <max>14.5</max>
                        </temperature>
                        <humidity unit="%">
                            <min>85</min>
                            <max>90</max>
                        </humidity>
                        <wind-speed unit="km/h">
                            <min>12</min>
                            <max>14</max>
                        </wind-speed>
                    </day>
                </days>
            </city>
        </cities>
    </country>
    <country name="Poland">
        <cities>
            <city name="London">
                <days>
                    <day name="Monday">
                        <temperature unit="°C">
                            <min>13.0</min>
                            <max>13.5</max>
                        </temperature>
                        <humidity unit="%">
                            <min>89</min>
                            <max>91</max>
                        </humidity>
                        <wind-speed unit="km/h">
                            <min>13</min>
                            <max>15</max>
                        </wind-speed>
                    </day>
                    <day name="Tuesday">
                        <temperature unit="°C">
                            <min>13.5</min>
                            <max>14.5</max>
                        </temperature>
                        <humidity unit="%">
                            <min>85</min>
                            <max>90</max>
                        </humidity>
                        <wind-speed unit="km/h">
                            <min>12</min>
                            <max>14</max>
                        </wind-speed>
                    </day>
                </days>
            </city>
        </cities>
    </country>
</countries>